rating,clean_review
2,patricia cornwell rocks best mystery writer on record like all of her scarpetta mystery novels patricia cornwell has proven again that she must have been one dynamite of a coroner when she was practicing she has a wealth of information in her books and it is so interesting to follow as she progresses to solving the mystery ive never enjoyed reading as much as when i pick up a cornwell novel
2,rekindling love mistakes can never be undone but rectification is possible years after their marriage died ross and tessa are drawn back together when one of their sons is diagnosed with a fatal illness returning to what has not been his home in a long time ross is met with a mix of hostility need and love before much time passes he realizes that his son is not the only one in need of healing with a society that has been torn apart by issues just like this the potential audience for it is vast mistakes are not glossed over but proven not to be fatal this will give hope to thousands
1,worst english dub of a great tv series this suckedthe worst english dub evercrayon shinchan is long tv series that lasted close to  years in japan funimation did not purchase the entire series just a handful of episodes so you dont see how the stories and characters developed and changed over the many seasonsthe english dub they made changed the entire dialogue and americanized practically all the characters and situations to an extreme low brow humor granted the original show did have a lot of puns and low brow humor as well but shinchan did retain an innocence for his mischief being the focus that he was always this incredible force of fun shaped as a  year old boy true fans of the manga and series should not buy this lame production by funimaiton
1,a piece of crap noisy crude five point vibration padnot a massager a vibration padwe purchased three of these and we sent back three of theseworthless no worse than worthless
1,no theory what so ever the authors seem unaware of the fact that theory guides our understanding there are no objective facts yet the authors present all their findings as such with almost no reasoning attached this is both arrogant and ignorant the authors display no grasp of theoretical advances in accounting and i recommend getting a book that has a better exposition of principles as more than practice
1,you sure can tell this was written by an accountant there sure is some exciting literature out there this is not it the material is very drydesert comes to mind i am using this book for my accounting  course at osu and boy is it fun note the sarcasm and whats with the dates in the example problems such as x what is that were they too afraid to put a  in there they didnt think we the students could handle it but hey im not bitter or anything i dont even think you could make accounting interesting a must read ha
1,wrong item i was going to get a book with a isn number of but today i got one with so i need you send my money beac to my account and give me a well reason why you let the seller mail me a totally different book again it is the second time i get an item with wrong number
1,worthless how this man has managed to write so many books while knowing nothing about  travel and  archaeology is a mystery to me first he shows up in jordan with no local money on a friday youd think someone passing themselves off as a knowledgeable traveller would have figured out banks in an arab country are closed on the muslim sabbath then he continues on with a series of quack theories about aliens and technologically advanced ancient civilizations and harps that make rocks float there not even good quack theories like hancock or buval who while equally worthless at least make an attempt to back up their theories read something else
2,theres no other book like this one there is no other book on africa or arabia like this one like in his other books childress rambles from place to place looking for mysteries lost cities and adventure if you are looking for some dry fossil hunter story this isnt it its the only book that i know of that covers such unusual topics as port cities in the middle of the arabian desert the history of the ark of the covenant the giant megaliths of the kalahari desert and other littlediscussed topics lots of old maps photos and illustrations it is a fun book to browse through as well
1,dont bother what a disappointment this book is about  selfcentered travelogue and  teasers about the mysteries i expected a book full of archeological information about cities and cultures that have long since disappeared but instead got embarrassingly ridiculous chitchat and superficial explanations i wanted scientific information not a book that tends to explain most of its mysteries via levitation and alien beings
2,lincoln and his time for the mpost part any book by david donald is worth the time and effort to read this book offers fresh insights into the perception of lincoln belongs on the shelf of every person interested in th century america
2,explains why economics and politics dont mix hazlitts view is simple economics can only be understood if we look at the effects on everyone over time he views most government economic tinkering as myopic focussing only on one group of people for a moment he shows how government interventionwell intentioned as it might bealways hurt people in general over the longterm including the people we mean to help he champions the forgotten manthe people who are hurt when the governmet tries to improve on the workings of the marketplace
2,a brilliant wellwritten economics primer hazlitt presents a clear concise lesson on basic economics his message is wellarticulated and wellsupported this is a must read for every person who has ever worked or voted or is planning to do either because it discusses the essentials in both economic theory and the politics that put the theory into practiceunfortunately there are some erroneous ideas in this book hazlitt occasionally makes claims or implies that the government should make some interventions into the economy he also seems to think that capitalisms merit lies in its service to the common good however these fallacies are rare and they do not significantly detract from the bookfor a great backtoback lesson in economics and its moral base read this book followed by capitalism the unknown ideal by ayn rand
1,dont waste your money if you are new to economics this is one book that you can skip it is not useful nor mandatory reading if you are looking to understand the subject better there is not even one chart or graph included in this book stick with naked economics undressing the dismal science or economics for dummies as these two titles will serve you better
1,more of a personal opinion than that of economics when i read something i like the whole story with some facts to back them up but what i got out of this book was a guy with one side of politics while giving his opinion although many of his policies i tend to agree with i just have a really hard time reading something when the entire book well i only got around a third way through it is swung in one way direction if you like reading about someones opinion then youll love this book but if youre like me and just like cold hard facts leaving it up to yourself at making your own opinion then dont buy this book
1,not what it claims to be i was actually looking for a book on economics this book is more of a conservative rant its not so much that i disagree with what he says so much as the fact that its all politics and very little economics buy this book if you want to hear how much the author thinks liberalism stinks not if you want economics in one lesson i definitely feel like i got tricked into buying it
2,the best book on economics i have ever readexcellent read for the layperson most relevant to our current economic crisis in america every politician should be required to read this book in fact every classroom teacher should read it as well explains the mess our government has created and why its continued destructive policies are leading our country to assured economic collapse policies based entirely on fallacies
2, starsa useful supplementary text for lower division microeconomic principles courses only this book is useful for teaching lower division undergraduate students the principles of microeconomicsit can be used as a supplementary bookhazlitt emphasizes the important concept of opportunity costbut neglects to incorporate any discussion of spillover effects and externalitiespositive and negativedepletable and undepletablemarket failurepublic goodsthe theory of second bestadverse selectionmoral hazard the principalagent problemetcit is interesting that all these missing topics were originally covered by adam smith in the wealth of nationsespecially in part v
1,title is a scam when someone is intentionally deceptive in order to sell books or to capture an audience this lowers the value of what they have to say to absolute zero
1,no help this book did not help me with my economics class even though i passed the course with a b this book reads more like a novel and really does not simplify economics at all i work better with definitions and examples and this book gives none
1,polemic and outdated i read this in the s and it was a nonevent back then like most books that claim to have the answer this book gives an enormously oversimplified view of economics that does not reflect the real world moreover it presents as settled many open questions claiming the authors opinions as facts there are many better books on freemarket economics and far far better books on economics in general
1,too simplistic although though were presumably members of the same political choir the author treats economics much too simplisticallycalling this book a polemic on keynesian economics would be accurate calling it an economics treatise would be just plain wrongtime would be better spent reading bastiat
1,this aint no economics book i was expecting a book on economics  so maybe i might understand market forces pe ratios stuff like thatits just a big argument for a libertarian government not even particularly good arguments either  theyre all based on metaphors like the broken window paraphrased from memoryeven though they may get paid a community does not get rich fixing broken windows that holds the community still it does not push it forwardthats a fine argument and all but thats not teaching metaphors are mental manipulation give me all the pros and cons and let me decide or better give me the damn factsand its outdated too the book is  years old we are so not in post wwii economics
1,no lessons learned this is one of the most disappointing purchases i have made on amazonthe book is one long myopic libertarian apology
2,best book on economics for the general reader this is an excellent introduction to economics hazlitt was a clear writer and his analysis of fallacious economic thought is very informative you dont have to be a student of economics  this is a book that can benefit every reader i just wish more of our politicians had read this book
2,if you dont have this get it this book is a wonderful illustration of the simple so simple they go unnoticed principles of a market economy and the many fallacies of adding socialism to the mixi could have easily given this  stars but i didnt have the option the only thing that kept me from giving it  was that hazlitt partially caves in about halfway through the book on the topic of unions unions are tantamount to coersion and have no place in a market economy
2,read the angry antihazlitt reviews for a real indication i think beyond the fact that hazlitt produces a succinct and wellargued explanation for why free markets are the best arrangements in economic relationships what is really wonderful is reading the screeds of those readers that he pisses off read the rabid ranting temper tantrum of the one reader who amazingly was accepted to the university of chicago and you can see how ideas that actually support free thought and productive profitable endeavors drive lunatics like this crazy  its awesome this dork probably marches against the wto
2,give this book to a your children economics in one lesson elucidates the basic principles of economics in a simple understandable language if you are just starting out on economics i would recommend this as your first book college textbooks will bore you and treatise like human action by lw mises are pretty hard for a beginneralso be sure to give this book to your children schools dont teach economics a most important of subjectswith that said i would like to comment on many  star reviews notice how they dont comment on the content of the book economics is a science and it is better to put away your political glasses when studying it
2,economics in one lesson economics in one lesson is another great must read book like bastiats the law it is short and sweet at the same time it clearly explains the basic fundamentals of economicsconsidering the stupid and abusive actions that are rampant in congress state legislatures county commissions and city councils the overwhelming majority of these socalled leaders are utterly ignorantdont you be one of thembuy and read economics in one lessonthen call up your politicians and give them an earful
2,never more needed than today sure a few of the specific examples cited  years ago are no longer relevant today but the basic lessons are absolutely and permanently valid and need more than ever to be understood by at least a majority of the voting publicthe sad fact is that americans can go through the entire public school system and higher education without learning the first thing about economic science while getting bombarded with selfserving economic propaganda thus public gullibility to the fallacies cited by hazlitt seems no less pervasive now than back then while the resultant cancerous growth of government economic meddling has only increasedheres a revolutionary fantasy make this book a required study by all high school students imagine what that would do for the kinds of politicians who get elected in the futurebtw you can get the nice hardcover edition at less cost directly from the mises institute
2,economics even you will understand for all who avoided economics like the plague this is the book for youvery informative and gives the novice a good foundation of the subject check it out next time you argue economics with uncle fred you wont sound like such a dope
2,simply brilliant this is a great start to learning austrian economics or rather any kind of economics all members of congress should be required to read this before being allowed to vote on any bills peter schiffs crashproof would be a great followup to reading economics in one lesson and for the more serious student of austrian economics especially in these times you should read von mises theory of money and credit and rothbards the great depression
2,one lesson that everyone needs to learn as a student and teacher of economics this book has proved to be an invaluable resource the lesson is simple and direct yet one that many people fail to apply this should be required reqding for anyone involved in the development of economic policy or any other arm of policy making for that matter whether you agree with hazlitts conclusions about how the market works or not you cannot dispute the key lesson of this book it is entertaining to read particularly easy for a book about economics i highly recommend it
2,textbook should have been a nationwide elementary school textbook for the past  yearsupon reading this book and knowing your fellow americans will have one couldntimagine the losses of freedom that we are experiencing now an absolute must read
2,our senators and reps should read and heed this is not a new bookperhaps thats why it is so usefulthere is no gobblygook no arcane economic theories with fancy lableswhat there are in this book are many examples of   if the government takes this action to make this or that happen the unintended consequences have proven to be and will probably be again something quite different and usually not positivesound experiential economics in my view clearly written and a tremendous help to understanding what will probably happen if the nation takes on more debt subsidizes this or that interest taxes one interest at the expense of another etci liked it i could read and understand it
2,great book very easy to read simple arguments that destroy many fallacies in current political rhetoric i learned a lot from this book without feeling like i had to muddle through it i benefitted from taking micro and macro before reading but its not necessary and anyone interested in learning about how special interests kill the consumer and taxpayer because their wellbeing is easier to measure and is effected more immediately aka every modern economic issue has an obligation to read this book
1,painful i wouldnt recommend this book to an enemy true the information may be worthy but the writing style and the narration were horrible it is definitely not written nor read in a conversational manner im willing to cut the narrator some slack as he was only reading what was written however better inflection phrasing pauses etc would have greatly helped this otherwise tedious booki couldnt even finish it i suffered through the first  disks and after all that investment in time i couldnt bring myself to listen to the th its just that poorly writtenill restate the fact that the message  the information  is worth hearing its simply written in such a tedious manner that i couldnt stand to hear it through the endi think ill donate it to my local library
1,unsatisfactory and very outdated i am in my s and thought it would be a good time to remedy what i perceived as a gap in my education economics i never had a course in economics and the only book i had read was heilbroners worldly philosophers a satisfying but very general overview as i recall i probably read heilbroner in the late sim an audible subscriber and got economics in one lesson from them i can only say that the book was dated full of economic events that were referenced from wwii and excessively polemical and rigidi read it some time ago but it made enough of a bad impression on me that when i saw it in my suggestion list around number  i just had to get onto this page and say what a terrible disappointment the book wasi think the book should be retitled economics in one polemic the shortest and surest way to understand the economics of the late s and the s
1,dont be fooled by the title of this book the only economic lessons in it are a very biased critique of any economic policy other than capitalist doctrine i wanted to learn about economics and was so disappointed in this outdated onesided book
1,hypocritical biased outdated and misleading this book opens with the author explaining his objective analysis of popular fallacies within economics in no way is this book objective it is not so much a introduction to economics than a book with a political agenda he rarely shows two sides of the arguement spins fact real well all the while omitting valuable information contrary to his veiws dont read this as your first economics book and if you do read it take it with a grain of salt
1,capitalism straight in small unpalatable doses if you want your faith in market forces and low taxation reinforced this is a straightforward but blinkered attempt to make you forget all about government regulation funny that westeuropean countries with bigger taxation and more government influence have less crime better education better health care better tv programmes than the us they also organise their politics better so that the tax money is better spent it did set me right on one or two points and parts are written in a spuriously funny way but it is too biased to be really informing  clearly the writer has never listened to people he doesnt agree withif you have an open mind compare this dangerous nonsense with the writings of naomi klein to see how unfettered capitalism works out in practice
1,rightlibertarian views presented as fact the problem i have with hazlitts economics primer is that much of the information he presents as fact is nothing but rightlibertarian ideologyhazlitt attempts to explode liberal myths by taking out of context the social advances america has made in the last  years the author believes that unchecked corporate power will liberate the economy and therefore humanityhazlitt is obviously a corporate apologists who refuses to scrutinize the successes of liberalized trade policies throughout the world a look at any number of third world countries will reveal the true outcome of relinquishing government and social controls of the economy
1,astounding it is astounding that anyone in this age can seriously recommend this book it has no bearing on the world economy and is blatantly anti labor and anti government regulation it is hopelessly out of date
1,how to fail economics  this book preaches a very right wing kind of economics if you can imagine one of rush limbaughs readers or helpers writing a primer on economics then this is it keep government small etc the author most likely was an austrian school follower as it is avaiable free on limewire maybe get a free copy on the net or browse it in your local library no need to buy unless you want to flesh out sic the ideas of mr limbaugh et al the book relentlessly hammers home the ideas that government should be amall self interest drives the economy forward and that state intervention is bad
1,read this if youre stupid and wish to be fanatically stupid very stupid once you enslave your mind to a blind fantasybased utopian distortion of capitalist society which has nothing to do with the actual functioning of that system on any level at anytime whatsoever and the top beneficiaries wouldnt have it any other way  no matter what this economiclibertarian garbage espouse this is what comes out of your pencil read this book turn off the real world and turn on to a reactionary and libertarianutopian rehash of greed plunder pillage and plutocracy worship touted as common sense
2,back to basics sometimes back to basics is the clearest path towards understanding current realities it is amazing to me that a book written in  is still so fundamentally relevant
2,a great alternative perspective particularly appropriate for these times even many decades after it was written hazlitts economics in one lesson offers an alternative to the traditional keynesian economic theory of the th century this book is a fairly easy read for noneconomists and though a bit repetitive towards the end quite enlightening id recommend this book strongly for any student of macro economics or anyone curious in what is happening to the global economy
2,sanity in economics this is economic sanity easy to understand if more people and especially those in government would read this book we would be better off
2,fine summary this is a great primer that should be read in all schools hazlitt does not deal in economic details here intead economics in one lesson covers more useful ground for the average person it cumulatively teaches us how to think logically about economic issues and of course how you think is the basis for what you think even the casual reader will take away an ability to spot economic silliness many of which spring from the same bad premises the same elementary blindness to causeandeffect economics in one lesson provides the type of knowledge that stays with you for a lifetime
2,a good libertarian primer this book is a little outdated and a little heavy on the libertarianism but otherwise its a very easy read and i particularly like some of the stories it uses to present basic economic ideas
2,important just under two hundred pages i learned more from this short book on economics than from three entire textbooks in college concise well worded and simplified reality anyone wanting to understand the market system and how it works can gain greatly by reading hazlitt
2,economics very clearly written with a minimum of jargon basic principles easy to understand even for the noneconomist but topics were not oversimplified essential reading for anyone who wants to make informed decisions in these troubled economic times
2,frighteningly prophetic an easy to understand overview of economics and when considering the condition we are in today scary it explains a great deal about our current economic problems though originally written in the s
2,great book this is a great introduction to economic analysis it is very well written and the examples are still surprisingly currentbad economic thinking plagues the political and mediatic scene hazlitt focuses his effort on a key mistake that of ignoring the unseen possibilities or opportunity cost
2,great summary of some very difficult economic principles this was my first experience reading hazlitt and it wont be my last he has an adam smith way of writing whether intentional or not whos to tell and everytime i wanted to compare this book to wealth of nations i quickly curbed my enthusiasm this is a good book not great and im not quite sure why all the great reviews i do like his way of explaining some very difficult economic ideas and i can see this book being a valuable introduction to economic principles maybe not economics  in summary well worth your time to read but not a good enough book to truly fit its title
