rating,clean_review
2,stuning even for the nongamer this sound track was beautiful it paints the senery in your mind so well i would recomend it even to people who hate vid game music i have played the game chrono cross but out of all of the games i have ever played it has the best music it backs away from crude keyboarding and takes a fresher step with grate guitars and soulful orchestras it would impress anyone who cares to listen _
2,the best soundtrack ever to anything im reading a lot of reviews saying that this is the best game soundtrack and i figured that id write a review to disagree a bit this in my opinino is yasunori mitsudas ultimate masterpiece the music is timeless and im been listening to it for years now and its beauty simply refuses to fadethe price tag on this is pretty staggering i must say but if you are going to buy any cd for this much money this is the only one that i feel would be worth every penny
2,amazing this soundtrack is my favorite music of all time hands down the intense sadness of prisoners of fate which means all the more if youve played the game and the hope in a distant promise and girl who stole the star have been an important inspiration to me personally throughout my teen years the higher energy tracks like chrono cross  times scar time of the dreamwatch and chronomantique indefinably remeniscent of chrono trigger are all absolutely superb as wellthis soundtrack is amazing music probably the best of this composers work i havent heard the xenogears soundtrack so i cant say for sure and even if youve never played the game it would be worth twice the price to buy iti wish i could give it  stars
2,excellent soundtrack i truly like this soundtrack and i enjoy video game music i have played this game and most of the music on here i enjoy and its truly relaxing and peacefulon disk one my favorites are scars of time between life and death forest of illusion fortress of ancient dragons lost fragment and drowned valleydisk two the draggons galdorb  home chronomantique prisoners of fate gale and my girlfriend likes zelbessdisk three the best of the three garden of god chronopolis fates jellyfish sea burning orphange dragons prayer tower of stars dragon god and radical dreamers  unstealable jeweloverall this is a excellent soundtrack and should be brought by those that like video game musicxander cross
2,remember pull your jaw off the floor after hearing it if youve played the game you know how divine the music is every single song tells a story of the game its that good the greatest songs are without a doubt chrono cross times scar magical dreamers the wind the stars and the sea and radical dreamers unstolen jewel translation varies this music is perfect if you ask me the best it can be yasunori mitsuda just poured his heart on and wrote it down on paper
2,an absolute masterpiece i am quite sure any of you actually taking the time to read this have played the game at least once and heard at least a few of the tracks here and whether you were aware of it or not mitsudas music contributed greatly to the mood of every single minute of the whole gamecomposed of  cds and quite a few songs i havent an exact count all of which are heartrendering and impressively remarkable this soundtrack is one i assure you you will not forget it has everything for every listener  from fastpaced and energetic dancing the tokage or termina home to slower and more haunting dragon god to purely beautifully composed times scar to even some fantastic vocals radical dreamersthis is one of the best videogame soundtracks out there and surely mitsudas best ever _
1,buyer beware this is a selfpublished book and if you want to know whyread a few paragraphs those  star reviews must have been written by ms haddons family and friendsor perhaps by herself i cant imagine anyone reading the whole thingi spent an evening with the book and a friend and we were in hysterics reading bits and pieces of it to one another it is most definitely bad enough to be entered into some kind of a worst book contest i cant believe amazon even sells this kind of thing maybe i can offer them my th grade term paper on to kill a mockingbirda book i am quite sure ms haddon never heard of anyway unless you are in a mood to send a book to someone as a jokestay far far away from this one
2,glorious story i loved whisper of the wicked saints the story was amazing and i was pleasantly surprised at the changes in the book i am not normaly someone who is into romance novels but the world was raving about this book and so i bought it i loved it  this is a brilliant story because it is so true this book was so wonderful that i have told all of my friends to read it it is not a typical romance it is so much more not reading this book is a crime becuase you are missing out on a heart warming story
2,a five star book i just finished reading whisper of the wicked saints i fell in love with the caracters i expected an average romance read but instead i found one of my favorite books of all time just when i thought i could predict the outcome i was shocked  the writting was so descriptive that my heart broke when julias did and i felt as if i was there with them instead of just a distant reader if you are a lover of romance novels then this is a must read dont let the cover fool you this book is spectacular
2,whispers of the wicked saints this was a easy to read book that made me want to keep reading on and on not easy to put downit left me wanting to read the follow on which i hope is coming soon i used to read a lot but have gotten away from it this book made me want to read again very enjoyable
1,the worst a complete waste of time typographical errors poor grammar and a totally pathetic plot add up to absolutely nothing im embarrassed for this author and very disappointed i actually paid for this book
2,great book this was a great booki just could not put it downand could not read it fast enough boy what a book the twist and turns in this just keeps you guessing and wanting to know what is going to happen next this book makes you fall in love and can heat you upit can also make you so angery this book can make you go throu several of your emotions this is a quick read romance it is something that you will want to end your day off with if you read at night
2,great read i thought this book was brilliant but yet realistic it showed me that to error is human i loved the fact that this writer showed the loving side of god and not the revengeful side of him i loved how it twisted and turned and i could not put it down i also loved the glass castle
1,oh please i guess you have to be a romance novel lover for this one and not a very discerning one all others beware it is absolute drivel i figured i was in trouble when a typo is prominently featured on the back cover but the first page of the book removed all doubt wait  maybe im missing the point a quick reread of the beginning now makes it clear this has to be an intentional churning of overheated prose for satiric purposes phew so glad i didnt waste  after all
1,awful beyond belief i feel i have to write to keep others from wasting their money this book seems to have been written by a th grader with poor grammatical skills for her age as another reviewer points out there is a misspelling on the cover and i believe there is at least one per chapter for example it was mentioned twice that she had a lean on her house i was so distracted by the poor writing and weak plot that i decided to read with a pencil in hand to mark all of the horrible grammar and spelling please dont waste your money i too believe that the good reviews must have been written by the authors relatives i will not put much faith in the reviews from now on
1,dont try to fool us with fake reviews its glaringly obvious that all of the glowing reviews have been written by the same person perhaps the author herself they all have the same misspellings and poor sentence structure that is featured in the book who made veronica haddon think she is an author
2,a romantic zen baseball comedy when you hear folks say that they dont make em like that anymore they might be talking about by the sea this is a very cool story about a young cuban girl searching for idenity who stumbles into a coastal resort kitchen gig with a zen motorcycle maintenance man three hysterical italian chefs and a latino fireballing right handed pitcher who plays on the team sponsored by the resorts owner as is often the case she finds herself through honest often comical but always emotional interaction with this sizzling roster of players with the perfect mix of special effects that salsa sound and flashbacks by the sea gets  big stars from me
2,fashionable compression stockings after i had a dvt my doctor required me to wear compression stockings i wore ugly white ted hose and yucky thick brown stockings then i found jobst ultrasheer they gave me the compression i needed  but looked like regular pantyhose even though my blood clot has been gone for  years i still buy these to wear as support stockings because they make my legs feel so nicenote i have problems with the rubberized tops rolling down my thigh i tried the jobst adhesive but i hated having my skin pulled all day i bought an inexpensive garter belt and it works fine and helps keep the stockings from rolling
2,jobst ultrasheer thigh high excellent product however they are very difficult to get on for older people i feel like ive had a full day workout after getting them on also as the day wears on they begin to roll down from the top and create a very deep ridge in the skin i have to wear them so if those two difficulties could be addressed it would be such a help
1,sizes recomended in the size chart are not real sizes are much smaller than what is recomended in the chart i tried to put it and sheer it i guess you should not buy this item in the internetit is better to go to the store and check it
1,mens ultrasheer this model may be ok for sedentary types but im active and get around alot in my job  consistently found these stockings rolled up down by my ankles not good solution go with the standard compression stocking  stock  excellent support stays up and gives me what i need both pair of these also tore as i struggled to pull them up all the time good riddancebad investment
2,delicious cookie mix i thought it was funny that i bought this product without knowing it was a mix i read the header very quickly and just thought it was packaged cookies but no it is cookie mix and i guess i should have noticed that since it is right in the titlethis is the first time i have ever tried baking with a cookie mix if you are used to the convenience of the cookie dough that you buy wrapped up in plastic logs then you might be in for a bit of a surprise mixing up the dough can get very messy it is extremely sticky however with a cookie mix like this you have a lot of flexibility in the ratio of ingredients i like to add some extra butter to make the baked cookies more chewy also this mix has really large chocolate chips in iti love thati removed a star for the addition of natural flavors in the mix
1,another abysmal digital copy rather than scratches and insect droppings this one has random pixelations combined with muddy light and vague image resolution probably the cue should have been the packaging is straight out of your street corner bootleg dealerif youve ever seen a reasonably good condition film copy you know the defining visuals of his film are the crystal clear lighting contrasts in black and white the surrounding countryside and old home scenes are set with early morning ground mists or the haze of memory while the events on the bridge and in the water are bright clear and immediatehere everything is dull dark and clouded or if you remember the timbre and enunciation of captains commands so are the visualsafter that it is hard to believe this award winning critically acclaimed films best presentation is on youtube somewhere out there is a dvd that comes up to the standard of a mm public library reeljust none of them appear to be on amazon
2,a fascinating insight into the life of modern japanese teens i thoroughly enjoyed rising sons and daughters i dont know of any other book that looks at japanese society from the point of view of its young people poised as they are between their parents ageold japanese culture of restraint and obedience to the will of the community and their peers adulation of western culture true to form the new young of japan seem to be creating an international blend as the ando family demonstrates in this beautifully written book of vignettes of the private lives of members of this family steven wardell is clearly a talented young author adopted for some of his schooling into this family of four teens and thus able to view family life in japan from the inside out a great read
2,i liked this album more then i thought i would i heard a song or two and thought same o same obut when i listened to songs like blue angellanna and mama the hair just rose off my neckroy is trully an amazing singer with a talent you dont find much now days
1,problem with charging smaller aaas i have had the charger for more than two years it charges aa batteries just fine but has a huge problem securing smaller aaa batteries to charge the smaller batteries you need to flip down the little button at the positive end in the beginning one of the four aaa batteries would pop up and now three out of the four wont hold the problem is the flip mechanism became loose and any horizontal pressure would push the buttons back up what i have to do now is using duct tape and a segment of crayon apply the crayon on the buttons and wrap the tape around you know how painful that is
1,works but not as advertised i bought one of these chargersthe instructions say the lights stay on while the battery chargestrue the instructions dont say the lights turn off when its done which is also true  hours of charging and the lights stay on i returned it thinking i had a bad unitthe new one did the same thing i just kept it since it does chargebut the lights are useless since they seem to always stay on its a backup charger for when i manage to drain all my aas but i wouldnt want this as my only charger
1,disappointed i read the reviewsmade my purchase and was very disappointed the charger is convenient by charging all four batteries at once but the charge only lasts a very short time i now have to go and find batteries that will give me longer life than the kodak nimh aa batteries
1,oh dear i was excited to find a book ostensibly about muslim feminism but this volume did not live up to the expectationsone essay among other things describes the veil as potentially liberating it doesnt begin to explain how or whyanother on muslim women in cape town claims that muslim women there are separate but more than equal gee whiz what a disappointmenti had expected and hoped for at least one muslim feminist condemnation of gender apartheid but there is not a single one in the bookim surprised it didnt have an essay extolling the virtues of female genital mutilationalyssa a lappen
2,based on the reviews here i bought one and im glad i did this vcrdvd was an early christmas present to myself after deciding to join the rest of the world in dvdland but not wanting to let go of my vhs movies quite yet based on the reviews and price and because i own a jvc tv this was my choice i agree with the easy setup its a bit awkward to work the whole tvvhsdvd selection options but i think ive gotten the hang of ittwo comments its not intuitive and actually is pretty complicated too many buttons on the remote but that might please others who are more technicallyminded than me so ive had to rely heavily on the howto manual and setting the vcr timer is awkward  you cant enter the start and end time but have to scroll unless im missing somethingbut those are my only complaints this is a good product for your 
1,incorrect disc i am a big jvc fan but i do not like this model i was suspiscious when i saw several units in the return section of the store i bought one anyway new and must say i am not happy the unit sends out clicks to the receiver once in a while the transition between scenes is not always smoothlike a little pause and while it is still fairly new i cant get any dvdcd or even a dvd headcleaner to work all i get is a incorrect disc message
2,happy with itbut im a jvc nuti have  jvc televisions one vcr one bookshelf audio system and car audio system so when it came time to move the vcr player to the boys room and get another one for the old man i knew what make it was going to be i decided on the combo player because i dont think vhs is going to be around much longer i like my combo player except for  thingsno cable box compatability on the remote control no seperate audio video inputs only input for coax cable from my cable box so all of the cable programming is in monowife cant tell the difference in the sound so if shes happy then ill just live with it vcr and dvd look and sound great
1,should be titled hollywood debacle the plot is so ridiculous i have to wonder if they even read the script before making this film the mountain lion breaks out of his trailer  and the cars behind dont notice the mountain lion is captured  and put in a jail cell get real utterly completely stupid
2,is this great tv you bet it is hotel babylon is not just good tvits great tv the show features some incredible acting from tamzin outhwaite formerly of eastenders a bbc soap and max beesley from the illfated movie glitter starring mariah carey the show could make for a great drama series but i felt that it is a mix of a drama comedy and soap opera all mixed into a great bbc show the show aired on bbc america for a while but didnt get around to seeing it i can now say that i got the dvd set and all the episodes are great the season finale was an interesting to watchthe show reminds me of hotel which aired on abc from  to  the reasonhotel was set at a fictional san francisco hotel as hotel babylon was set at a luxury fivestar hotel in englandi recommend this dvd to anyone who is willing to watch a great show from the bbc
1,nothing you dont already know if you have even casually looked into applying to law school have already read everything there is in this book do not waste your money seriously
1,unfortunately it wasnt entertaining in the least bit when i first ordered the cd i figured it was going to be a hip cool daddy vibe cd however much to my dismay it sounds like a fourth grade music class the main jist of the cd is that there is a xylaphone playing over peoples voices trying to replicate happening party i believe if i played this cd at a party anywhere in my neighborhood i would get laughed off the beach growing up a surfer in san diego i would not recommend this cd to any of my southern california brothers honestly when i played it i kinda of felt i was in a bad b movie the absolutle epitimy of the cd is the last vibe surf cha cha surfers dont cha
2,rochelle explains it all for you wondering what the hell has happened to the moral aspect of modern american culture  this book is a lucid well argued explanation of the simple fact that we have become so totally focused on our individual rights that we have completely ignored and even mocked our personal and public responsibilities the final response and indictment of robert ringers best seller looking out for  this is a great time for anyone who is disgusted with the boorish state of american media politics and discourse in general to clear their heads for the substantial challenges that lie before us not only as americans but as human beings a great book
2,more great playing larrys work for the muse label in the late s and early s found him exploring the rich catalog of jazz standards that he probably grew up playing surrounding himself with the best musicians around larry sounds relaxed focused and totally in control listen to larrys take on my funny valentine and tell me it doesnt stand right up there with chet bakers or miles a very fine album that youll enjoy again and again
1,doesnt work on a mac it clearly says on line this will work on a mac os system the disk comes and it does not only windows  do not order this if you have a mac
1,very frustrating my three year old son was very excited to get this but after two attempts at playing it hasnt been touched since you are not able to use the mouse through any of the games except for the powerup segments instead you are using the updown arrows on the keyboard  too hard for him and not much fun very disapointed with this game and wish i could return it
1,mind numbing this game makes you do the same things over and over it never holds my sons attention long enough to get to the next level there is no choice of games you have to do every thing in order we have another rescue heroes game and both my boys  and  love it but this one is a dog
1,cannot recommend as a former alaskan i didnt want to have to do this but after repeatedly attempting allmans recipes and having to throw out  cups of flour and miscellaneous ingredients nearly every timeand then comparing to ed woods recipes which work flawlessly and lisa rayners very excellent wild bread handbaked sourdough artisan breads in your own kitchen i cant help but notice that their recipes work where allmans failim not a novice baker the only thing that worked reliably was the pancakes recipe but that can be found other places as wellif you are looking for reliable recipes and concise information about starting a sourdough and maintaining it i recommend any of ed woods books even his very old ones lisa rayner has written a fabulous tome in wild bread but pass on this bookwhile some of the historical vignettes were interestingnot enough so to warrant the cost of the book check it out at your library if you must
2,alaska sourdough read most of the book while visiting my brother in alaska loved it i am going to be making my sourdough starter soon book is full of great stories and recipes
2,old and good this book is worth to keep in your collection as it does not only advise what to do with sourdough but ruth also told you what the picture of past  years ago in alaska where no stand mixer nor any civilized stuffs in kitchen just a pot of sourdough
2,autumn got this for my daughter in nc she is now making prefect bread wish she lived closer to make me some
2,fast mp download of music waxed decades ago one of these  songs played as background music on a youtube video of some kind of gymnastic or dance feat out of russia i hunted down the melody read the english lyrics then decided to see what else was in the album downloaded the full album for  via amazon mp downloader and now happily listen to the melodies interspersed on my ipod
1,maybe i got a bad one my experience i got this from fm not amazon the dvd player rattled pretty loudly sometimes but not always when i put in a dvd i tried several the picture quality wasnt all that great and the screen got a horizontal line thru the middle after a short time that would not go away plus one of the other reviewers was dead on about the remote  the layout makes no sense at all very poor human engineering imo i brought it back to the store for a refund i saw the same model under the emerson name for  at wm but was hesitant to buy it
2,sylvania ldg  flat panel lcd tv with built in dvd player light weight space saving very attractive design sharp picture good sound quality and quick response time dvd playback also excellent only negative is its remote control it is hard to read the functions of the keys due to color choices the placement of the keys are almost illogical and you have to look at it carefully before each use it almost seems like it was designed by an imbecil the quality the features and the price still makes this tv an excellent buy
1,terrible do not buy this i bought this for my wife for her birthdayand had toreturn it because the dvd palyer would not work i returned it and got a repalcement which once again the dvd player failed to work it is a piece of junk
1, beware  this tv is set so that it is not capable of a recall function if you want to flash back between channels this tv is not going to give it to you the remote control that comes with the tv has no recall function so i bought a sony universal which is a much better remote that had the recall button on it however i soon learned that the tv is set at the factory to not have the capability to flashback it may not be a big deal to some but this user found it very annoying
2,kitchen tv i bought this to replace a  tube tv in my kitchen what i gained was a larger screen plus relcaiming the counter space the picture is good and the internal dvd player is a bonus all in all a good purchase
2,nice for the money the first one i bought was defective the dvd didnt work at all i purchased it from electronics express and when i contacted them they were wonderful they gave me an rma number right away fedex picked it up the next day and a new one arrived  week later this one is just fine i really love the clarity of the picture my only complaint is that in dvd mode the sound isnt loud enough i have it in my rv and with the ac running i can barely hear it i solved the problem by running an audio out jack from the tv to the input on the rv stereo speaker system its very lightweight and easy to move around and store a bonus for the rv the remote isnt great but it works just fine and the videoaudio jacks and antenna input are easy to get to as is the dvd player all in all its a great deal for the price
