rating,clean_review
1,extremely shallow this book has no plot and is so absolutely predictable that i had to put it away without finishing sean dillons character is getting so tired and his invincibility is sickening a very poorly written book the only good thing about this book is that i got it from the local libary and did not spend any money on it mr higgins its time to retire sean dillon and maybe spend more than  weeks on writing a book
1,cartoon arabscottish villain i had the rare experience of giving up on a novel after only a couple of chapters when trying to read edge of danger recently but higgins managed to pen a book so lame that i refused to go any further his bad guy is supposedly a scottisharabian aristocrat but comes off as just another cartoon arab terrorist with an implausible pointless heritage but what do you expect from a middleaged author who poses in bomber jacket and aviator glasses on the dust jacket depth
1,cant believe i read the whole thing given the lack of character development or rather simplistic and at times contradictory character development the lack of any plot whatsoever and poor visualizations i cant believe i read the whole book i guess i kept waiting for the action to start it never did
1,id rate it  stars if i could have very few books contain their own review this one doesstone said it really is like a bad movie harryyou can bleeding well say that again   this book reads like a th grade readinglevel condensation of an outline of a screenplay the paragraphs are no more than a few lines long very few words greater than two syllables are used no complex thoughts no character development no suspense and little description pure formulaic twaddle
1,a bad book poorly written the plot is not believable there is not a shred of character development and there isnt even any descriptive atmosphere it shocks me that jack higgins and the publishers actually make money off of this puerile drivel i shall not buy any more of his efforts
1,higgins disappoints this is without a doubt higgins least inspired work in years the plot is predictable and over worn and the books is very uninspired a real disappointment
1,poorly written the style of writing leads me to believe that higgins was under pressure to churn out a book to meet some editors deadline there was no character development critical turns in the plot and action were blown through without the slightest bit of suspense ive never read higgins before and likely will never read him again
1,a disappointment it is hard to believe that the same author wrote the eagle has landed and edge of danger the writing is just plain shallow the plot predictable save your money for something better
1,horrible this is my first jack higgins book and it will certainly be my last especially if as the reviews state it is the best higgins book in a long timethe characters are never developed the way the book begins you think that the rashids are the good guys and dillin is the bad guy then all the sudden without developing the characters the roles are switched you end up not caring who dies and  billion people die in this booka little overkill and who livesthe adventures are similar to dora the explorer in how boring they are they are very predictable and of course dillin is killing  people and no one can kill him just ridiculous scenesdont get this book despite the reliablity of the author
1,not worth the effort edge of danger is yet another installment of the ongoing saga of dillon ferguson and bernstein if you truly enjoyed the preceding efforts by higgins then you might like edge of danger because it is more of the same however if you have been growing disenchanted by higgins efforts then you probably want to take a pass on this and for me at least future efforts as well higgins books are more and more like screen plays and less and less like novels dialog between the characters which often is terse choppy and unimaginative makes up virtually all of the text higgins almost completely avoids the opportunity add any depth and breadth to the story through the use of descriptive text as with the last few books from higgins edge of danger is clearly a disappointment
1,cant believe the publisher had nerve to issue this book a terrible childishly written book with absolutely no redeeming value as literature higgins loves to speak irish but even that gambit fails in this trite poorly plotted worthless endeavour by a writer who should remain retired if he cant do any better than such trashy writing
1,disappointing and thin i purchased this book expecting very good things i found the plot very thin and predictable there was very little suspense it almost seemed like an abridged version of a book where all the detail leading up was left out also there didnt seem to be any character building or background to explain why these individuals would have such singleminded and on the surface stupid behaviour
1,two hacks i dont know who is worse higgins or macnee the plot is so tranparent you can guess what is coming next completely implausible macnees narration is so overdone it is laughable most of the time the characters do little more than quaff enormous amounts of bushmills irish whisky a real stinker wayne schwartz los angeles ca
1,just skip it when you read a book you know that what are you reading is not  true but when you start to read things that are completely wrong is another thing for an example i have these questionsq how many times could a man pay another man to kill somebody the killer fails and the boss gives him another chancea i dont know if the mob knows it but at least four timesq why the target man who knows who is trying to kill him and he saw him in a restaurant after he was in danger and just say hello to hima because the target man likes to be in dangerq when the target man has the opportunity to kill the one whom wanted to kill him why doesnt hea because something in his head didnt let him even if he had killed many men beforeand as the energizer rabbit i can keep going and going and going my advise is to skip this book
1,worst live recording ive ever bought i bought this cd for one song only steal away i knew it was going to be live but this isnt even close to the radio version try more like a muzik lounge sound it was recorded in a ballroom then the only other song i recognized was hot rod hearts again done the vegas lounge style i wish i could get my  back why didnt he just put out the cd using the regular recordings he was never a big star to begin with i wrote this review just to warn people that it isnt like most live recordings i was very dissapointed and i still dont have a decent recording of steal away
2,a different collection of early stuff this is among the first ellington cds i owned and remains among my favorites it presents a nice survey of earlier material with many of his greatest hits as well as some less familiar tunes ie ones you dont find on every collection of early duke ivie andersons vocals really shine especially on it dont mean a thing if it aint got that swing not every song was destined for greatness but the lyrics to love is like a cigarette are a hoot the sound is decent considering the age of the recordings
2,great reference the book was good kept my interest in no way am i finished reading it it isnt a book to read from front to back the information on each herb is detailed great reference material it was a good addition
2,excellent resource book i picked up this version of the herbal magick books because i wanted to see what mr beyerl had t offer to this vast and sometimes conflicting magickal practiceafter reading through the book and using the index to find what i am nedding i must say where is the master book of herbalism i want itmr beyerl has done tons and tons of research on this material check out the bibliography and it shows his entries are precise with magical associations common names and other names it also includes suggestions for usenot only that but it takes the time to explaint he various ways to use herbsthis is a wonderfull addition to any occult library
1,has no value if your studying herbs or medicinal plants this book should not be on your list of books to own it is worthless it is a pagan religion book plain and simple in my opinion it is for the study of witchcraft and the like
2,really great baby book for your legged children this is a wonderful book for anyone who loves their dogs as children i bought one for our  year old adopted beagle and am getting one for our daugherinlaws birthday for their rottie you can personalize it as you wish and i have included comic clippings marmaduke mutts etc that are appropriate along with the photos and have created the beginning of a great book for my best friend that i will keep forever
1,needs  upgrade only has limited access to obdii data stream unless you pay more money to upgrade the software
1,only windows xp and earlier support this scanner works great but if you want to update the unit or use their printing software you can only run their drivers on a windows xp machine or earlier windows xp is over  years old you cant load the data from the scanner into your computer if you have vista windows  or windows  they seem to have no plan to update their system for this scanner or any of the ez scan linekeep in mind microsoft is dropping support for windows xp in spring of  a little more than a year away why dont they have something that works with more current computers especially when you can only buy one with windows  or mostly now with windows in addition for most of their models the firmware is  and i believe the  stands for  as thats as current as the unit shows for cars if you have a car  and later it doesnt show have to ask why they dont want to update the software for their products and still expect people to buy them
1,not very well written this book was well reviewed and i was very disappointed even if its written for poor readers does it have to read like dick and jane children are young not simpleminded give kids real literature or they wont keep reading theyll plug in to the media
2,hypatia a classic story based on history one of hypatias crimes appears to have been ready to provide a hypothesis of a heliocentric universe long before copernicus and with a much worse response from the christian community
1,scarlett letter very disappointed the book was missing several chapters because it was needed for school we were forced to purchase another copy
1,boringridiculously long chapters the book i downloaded on my nook and kindle doesnt seem like the same one i read in school this version bored me to tears
1,scarlet letter very hard to read doesnt seem to go anywhere i am struggling to finish it and may just give up
1,the scarlett letter written in old english it was very hard to read as i had to think through most sentences to figure out what was being said
1,a thorn in the side of literature hawthornes use of symbolism throughout the book is undeniable yet his obvious alcoholism takes over as the underlying factor present at all points he relies on ambiguity far too often without the build up to a climax the climaxes happened before the book started and only happened to a select few who read this book read atlas shrugged anthem or virtually anything by aldous huxley if you want some entertainment
2,a moral novel with a mystery i read this book during a high school vacation although the long words and unconventional characters did not catch my fancy the mystery involved in the story captivated me as the story developed i realized the profound intricacy of the plot the conclusion of the story was not happy nor did it even seem fair as one who knows hawthornes puritan morality standards however i say that he communicated his message extremely well
2,excellent book i read this book for my th grade lit class and i must admit the book was quite a shock many of the books i have read have been nothing more than an attempt at delving into the inner parts of the human soul this book does much more than that it depicts the struggle of a man with himself and an outside enemy he commits one of the most unspeakable acts of the time and punishes himself constantly he lacks the courage to confess his crime and goes through a period of mental and physical torture he also faces the wrath a cruel and vicious enemy who lives for nothing more than to torture his victim all in all i believe it was an excellent book and i would reccomend it to anyone
1,technical problems with cassettes this product requires a stereo player in which the balance is turned totally to the left most auto systems have that capability however if you have dolby or surroundsound it can be difficult and maybe impossible to play the cassette without hearing two recordings at the same time unfortunately neither the packaging nor the website will warn you of the problem you therefore should think before buying once you have opened the packaging you may be unable to return the product
1,mundane tedious just plain boring with so many allusions in literature and culture to the infamous a worn by hester prynne i was very excited about reading hawthornes masterpiece needless to say i was extremely disappointed i did find the symbolism that dealt with pearls fascination with her mothers a interesting but the rest of the book i did not other than to be more literaraly savvy i would not recomend the book
1,oh god kill me now this book is bad this is my moms account i had the pleasure of reading this book in english this year i can honestly say it is the single most boring book ive ever read you will never find someone my age that enjoys this story it has no action no suspense it isnt deep things dont symbolize anything if they do then youre thinking too hard this book is not a classic it is the worst id recommend copying a dictionary before id ask you to read this pile do not even think of buying this
1,absolute waste of time my th grade english teacher tortured me with this morbid book and i cant say if ill ever forgive her not only was this this book boring but hawthorne unnecesary uses all sorts of complex language to convey one simple thought the only reason that i didnt give this book  star was because there was some art in the book and symbolism way overrated
1,a tedious read i hate hawthornes style of writing its overbloated and selfindulgent i wish hed just get to the point and stop blabbering on and on the plot of the book seems like a modern melodramatic soap opera all of the characters are onedimensional im not going to say the book is poorly written but its written in a style that makes the book kind of boring and tedious to read overall a disappointment
1,classic really i will never understand how classics become classics so far for school i have had to read far to many classics dickens should be glad he is dead and does not have to read his books because they would probably kill him out of sheer boredomhawthorne creates an ok tale but really it gets dragged out and is suppose to be realistic then he throws pearl in there she is like some superhuman and belongs in fantasy i never really did believe in the whole they completely ostracized her but let her stitch everything that is just a bit hypocritical either she was excepted as prat of the society which she was not or she wasnt which she almost was see that just doesnt make any sense the story is suppose to show how unforgiving the society was but it doesnt it is better than dickens but then again everything is
1,this book was ok the scarlet letter for me was just a little boring sometimes the description was just too long and i just started to lose interest in it also sometimes it got confusing as to what the relationships the characters had to each other i would only reccomend this book to other people who liked reading lots of description a little dialouge and a repetitive storyline
1,ive read better im a  year old kid and i just finished reading this book for an english class i am taking although it was a very interesting and provkitive novel i did not like it very much i think it maybe that im still too young to throughly understand this piece of literature
2,awakening this book is a masterpiece of not only american literature but of world literature reading this book was the experience that showed me what good literature is this is easily in my top three along with fahrenheit  and the adventures of huckleberry finn
1,the scarlett letter overall ok not much going on here a lot of internal dialogue nothing like the movie i prefer the movie to the book
2,great condition almost exactly what i expected i was quite pleased with the condition of this book as well as its hardcover and the footnotes definitions and reading reviews for beginner readers of the genre i am of course a huge fan of the scarlet letter itself and this copy served its purpose well one of the few disappointments was that the color of the cover seems to look a little more coral or pink than scarlet or red also the back cover is white and i am most definitely one for appearances i would have like a slightly more classic looking cover nonetheless the binding will look fair on my bookshelf over all the book was clean and well taken care of and was shipped to me with great haste a good buy
2,gripping this novel is an opera pure and simplegranted it is not the easiest novel to read and hawthorne can be slightly repetitive with the metaphors similes and analogies that sometimes go on for several lines not to mention you could probably read half of each chapter and still keep up with the plotnonetheless the themes are so strong it is no wonder the scarlett letter has been deemed a classic the story tackles the issues of how one deals with hisher sins and how honesty for some comes at the price of great shamethe novel does take patience but it moves along at a very neat pace had the novel been written with more scenes and less exposition it could have been even more grippingi read the readers digest edition which comes with about  lovely illustrations which capture the essence and the mood of the novel so that was nice eye candylook out for the last three chapters  talk about a falltothe floor clutchingattheheart climax its all here breathtakingenjoy
2,good read but hard to navigate ebook i have long wanted to read this book by nathaniel hawthorne it was one of the first books i downloaded when i got my kindle  the character portrayals are superb it analyses the thoughts motivations strengths and weaknesses of the four major characters in the story  hester prynn the vengeful doctor the hapless minister and hesters vivacious and elflike daughter pearl the description of the little girl and how she copes with being ostracized with her mother by a rigid puritanical society is especially moving while there are some descriptions of nature that are quite vivid most of the text goes into developing these four characters and is a fascinating psychological study though at times its little slowoverall a wellcrafted story and a good readthe book though is hard to navigate on the kindle because it has no active table of contents i therefore would not purchase this version at regular price luckily its free
2,why  stars because theres no th a friend of mine called this book ponderous she read it in th grade go back to this one i keep returning to it myself maybe its in response to my parents divorce and how hawthorne handles adultery  not the danger and desire but the punishment and crime hesters story begins outside the jail house an american sex crime read it as such trust dover for a good cheap reprint
2,love it book is a great read intriguing from start to finish cant find anything wrong to say would reccomend for beginer to advanced readers
2,remembered from high school eons ago i purchased a kindle because i am having surgery on both hands and this was one of the first items i downloaded i have enjoyed reading it again and look forwaed to other free classics from the kindle store  way to go amazon
2,a classic i loved this book in high school and i love it now a tale of a strong woman that doesnt let society bring her down
1,typos the most irritating part about reading this book is the typos the book is already difficult to read with hawthornes prolix writing i had to check with a different edition of the scarlet letter just to confirm whether or not it was a typo also it would have been nice to have some footnotes like other editions do
2,decent book but definately not hanry david theraou it was a good book to read given that is a classical in american literature but i much rather like theraous book walden
1,boring i tred to enjoy this novel in fact i battled through to about halfway hoping it would get better but it seemed to me a silly pretentious novel the history of life in that era was mildly enjoyable but i applaud anyone who had enough tenacity to stay the whole journey
1,hi d d this y cf thy ff hertzberg toughening bc tiny ctv jim i by  bc cobb h cc mcg  cc
2,its great this is the great and very interesting book to readso for your great experience pls try it as soon 
2,the scarlet letter the book was wonderful and in good condition i purchased it for my daughter who is in highschool the book arrived around the time it stated it would above all of that the price was great
1,review from one book at a time i hate giving classics bad reviews this book was not for me nothing captured my attention and i found that i had to force myself to read it if it had been any longer i would have stopped it did catch my interest a little in the end but not enough to redeem the book in any way
2,amazingly good i came up to this book a reading assignment for school with a bit of dread having heard that hawthornes writing could be hard to read actually it was a delightful suprise to find it was a captivating plot very well written and very easy to read i enjoyed it thoroughly this book is about a woman who has an affair choosing to bear the scarlet letter than reveal her lovers identity along side her is her ilegitamate daughter a delightfully and hillariously strange character in the book the scarlet letter is a good book having a melancholy but redeeming ending a definate classic check it out itll be better than you expected
2,interesting book though im not a native english speaker i didnt find it difficult to read it it clearly represents a period in american history which probably many would like to forget about sorry for high school students who couldnt understand it something needs to be done in order to improve their reading comprehension and interest in their own culture
1,not my idea of a good read ive read worse but it takes a lot of mental energy to wade through all the commas and figure out the point of each paragraph it seems a lot longer than  pages i wouldnt have read it if i hadnt been forced to by the school and the introductory thing is torture
1,good book to read if you were bored to death i read this book over the summer because i had no time to go to a library or a bookstore and i had gotten to book for my birthday from my aunt back in may i usually read all the time if its a good book i can read it in less than  day sometimes it even takes me  hours but this book took me  weeks i couldnt believe how long it took me then it turns out that i have to read it this year in school ugh please dont read this book only if you love very old books that are very hard to understand
2,a well written book the scarlet letter was an great book in that it kept me reading it was not boring it had sense to it it has alot of symbols in it that makes sense and has a purpose instead of just being there
1,the scarlett letter is too verbose i had to read the scarlett letter for my honors english  class i found that the author was too verbose in describing people places situations and just the story in general the book was so wordy i often found myself forgetting the topic of that particular paragraph also i was disturbed to find out that ever day the reverand a dimmesdale would beat himself and stay up till the early morning hours
1,bad book this is from a students point of view im not a reader type so this book for me was awful i can see how people might like it the storyline is great all the themes and everything but the thing about this book that turned it down for me was hawthornes style coming from a time where authors get paid by the word lets just say it takes him ages to get his point across
1,duller than dirt i teach high school english and was required to teach thisto my students i dont know who suffered more me or themto be fair as one of americas first novels it has interestingelements and hawthorne does a good jobon the other hand it is excruciating to read there is nosuspense little to sympathize or empathize with and evenless to enjoy a better writer could have told the samestory in half the number of pages some have labelledthis book a tragedy they are right only in the sense thatit is tragically bad
1,i must say that i dont like this book i read it in high school when all i did and still do was read everything i could get my hands on i love literature i am even majoring in creative writing in college i understood the book what it was trying to say the plot etc i just thought it didnt do a very good job of saying what it was trying to say it was unnecessarily vague what is the reason behind trying to confuse somebody wordy highflown and just too big the story could have been told more effectively as a short story even half the length i dont reccommend
1,too hard to follow the way the characters in this book speak makes it too dificult to follow along i tried to follow along but too boaring also the book is mainly based on her thoughts there is not a lot of human interaction with the main character
