rating,clean_review
2, humans and  vampires after a vampire slayer i just loved daughters of darkness i must of read it about  times really its such a good story line you just have to read it tunes of times but it didnt really explain how jeramey got there how would he how where they were going
2,im hooked and i want some more  ive only read up to soulmate of the night world series but sofar ihappen to be in agreement with almost all the other reviewers ash is my favourite male character did anyone notice that so far only ash and marylynnette tried to fight their attraction but why was it called daughters of darkness when rowan kestrel and jade werent actually the main charactersps i think l j smith should let more characters become vampires and how come all the maincharacter vampires are all male and the witches female
2,lj smith has so many correct details im writng again to say that this book has so many correct details and the other books in this series are correct too for instance speelbound has it right calling the salem witch hunts the burning times real witches do to isis is a a major person in witchcraft and hecate was the first witch lj smith might as well be a wtich or vampire or whatever else for all the right details she has
2,it was great i like it it was very cool to read about vampires and other legendary cratures of the night
1,disappointing i bought this book because i am a nonogram also called paint by number addict and cant get enough of this type of puzzle my disappointment is not so much with the quality of the puzzles within it but with the quality of the publishing the paper is poor quality it wont hold up under much erasing if you use pencil and if you use gel pens the ink bleeds through to the other side the squares to color in are too large making the finished image very pixillated and hard to make out also the guide numbers are located at the right and bottom edges of the puzzle instead of left and top making it more difficult for a righthanded person to see while solvingsave your money and buy the games magazine publication instead
2,mirroring the reader i find it fascinating that this wonderful glimpse into our nation shortly before the american revolution could be thought of as stuffy boring and a waste of time hofstader a brilliant and yet very human scholar has offered us a wonderfully concise compelling and illuminating read  a rare and precious gift to anyone wishing to examine the evolution of our nation he has done all the work not only allowing us to form our own conclusions from the facts rather than spoonfeeding us his unsubstantiated opinion but has presented this vast amount of data in a breezy very readable manner the only explanation i could arrive at of how anyone could find this great book a waste of time is that these reviews are as much a reflection of the reviewer as the book under reviewbravo professor hofstader i regret that you did not live to complete your masterpiece
1,dont waste yout time unless you are under obligation to read this for some sort of class i would not recomend wasting yout time trying to wade through the quagmire of redundantly long boring text if i could pay attention to it for more than two sentences at a time most likely i would find it to have a wealth of information but its dry overlyintellecual style makes it impossible to stay interested if youre looking for a challenge to read you face two deciphering the nealry  pages of rediculously long sentences and staying awake i even go so far as to say reading it is a complete waste of time because the energy you must invest to understand this work coupled witht the frustration of an endlessly boring stlye does not even compared to the information you will actually get out of it
1,thick dry and packed full of somewhat useful information to read this book you need to be fully awake and have full concentration this is not the type of book to bring to the beach though richard hofstadter makes a convincing case of what colonial times were like and he obviously was a scholar he writes very monotonously if not thouroughly interested in american history at  i would not recommend this book otherwise if you are a historyfanatic this book gives a wide range of perspectives and fully covers the history of the time
2,kylie takes a bite at subtlety kylie minogue isnt a very subtle performer  shes famous for hinrg floorfillers not purring ballads a ballad in the hands of a pop singer can be a nightmare but with kylie its a dream and chocolate is a perfect example of it sweet and slow it flows like its namesake throughout with a catchy chorus that will for sure melt her fans down remixed for release this cd also includes the funky city games two remixes the emo mix is the better one and a live track taken from her body language live dvd which should receive a late  release in the usa
2,a rare  wondeful treat i was extremely lucky to have found this because it is a an import  b limited editionespecially lucky to find just thrown in the kylie section of a pennsylvania borders ok here it is trackbytrack chocolate radio editwhile this cuts the album version of the song by one minute and two seconds its better her vocals are improved  more of an arrangement is used  city games this extreme rarity is fabulous very rb pop  chocolate tom middleton cosmos remix a club dub cool when you have so much energy in you that you have to dance it out but not for a regular listen  chocolate emo mix woderful a good rb dance mix of the song  love  first sight live a live version of the fever hit i usually love live sounds but this when isnt quite up to par with the original i still have yet to figure out how to access the video overall great package great mixes great rarities
2,nifty it is very convenient to have the charging cable available without having the cord all over the place in the way works well too
2,grandson enjoyed maybe  times fine boys and the toys or trains i forget how many times kids can watch a movie and then watch it again
1,very annoying this video is really a disappointment it came with a thomas piece so naturally my daughter picked it and i thought the bonus feature wouldnt be mixed in with the actually thomas stories but i was wrong my daughter easily lost interest when the people would come on and talk about loving thomas and getting to ride the real thomas train i was totally annoyed
1,extremely disappointed with this video i never write reviews but i just felt compelled after i saw this video its  listening to parents and kids think about thomas and maybe  thomas related what is worse is that you have to fast forward through a bunch of the rambling in order to see what amounts to a  minute story and there is only one song in the sing a long i really liked thomas stories after watching them on pbs with my daughter next time i will try to find those stories on video they actually last about  minutes and do not involve mindless prattle from people i dont know
1,just soso this is a dvd with footage of a come out and meet thomas day mixed in between the episodes sort fo a promotional piece to be honest still decent enough to rent the dvd extras are limited and not very good my son seems to like it o kay but it gets pushed aside for more interactive stuff to be found on sodor celebration there is also a ton of toys shown during the partyinterview footage which can be a good or bad thing depending on how much you need to control that sort of thing with your child also i for one get annoyed at the interviewes not sure why they just annoy me this production has the feel of an old vhs video copied to dvd without much added to it i wouldnt throw it out but i wouldnt buy it either
1,more than thomas not geared toward children as much i bought this thinking it would be packed with thomas stories turns out there are only ten which is a typical thomas dvd however between each story it also has interviews with parents and their kids about what they like about thomas as i parent im not interested in this and i know that my  year old would rather watch thomas than a bunch of strangers any day plus the singalong section has one song one we have other thomas videos that has at least  and they arent special dvds just normal thomas collections i wouldnt recommend this to anyone if you are looking for solely thomas stories and can find other collections
1,a long promo for the thomas centers unless i missed something there are only one or two actual episodes on this dvd the rest is a long commercial for the thomas the train centers and an ode to ms allcroft waste of money
1,poor dvd has too many interviews with people at the live thomas day in penn my kids were annoyed and hated this dvd
1,my son finds it annoying my  year old son is huge thomas fan this dvd has long introductions to each story in which children and adults are interviewed  my son couldnt care less he just wants to see trains we have a portable dvd player and it is a big pain to try to fast forward past these introductions and he and i just ends up frustrated my advice  pick another dvd
1,feels like a commercial all the interspersed kid and parent interviews where they talk about all the trains they have just feels like a thinly disguised effort to sell more productits also awfully frustrating that you cant jut buy the dvd series here as you can in the uk but have to make do with compilations where there are invariably episode duplicationssigh
2,makes you not want to sleep at night this is about a kid who when asleep unleashes something horrific part two of the night warriors it is a brilliantly done novell and i recommend this to anyone who is a gore fanatic and masterton lover
1,k warranty isnt included in packaging or at apc site this product description is wrong i purchased this product because of this  equipment warranty product received only states that the actual surge protector is under warranty and has no mention of equipment warranty is amazon starting to make stuff up now
2,great little surge protector great value for a surge protector ive got em on lots of electronics printers phones laptops that dont need a full power strip or universal power supply ups very portable for laptops in case youre travelling
1,too small i have bought dockers for years but these are cut smaller than they usually are even with the stretch waist band they are tight so much for an extra inch beware try these in a store before you buy
2,a good product available in convenient range of sizes this product earns five stars not just because it is comfortable to wear and looks good but because it is available in more size inseam ranges than other dockers products and by ordering online one can largely avoid the disappointment of store stock outs
1,tom atkinson review i did not get the slack that had the waistband i got slack with no waistband so i send them back an was trying to ge a   but i received a e mail stateting that the product was no longer avability so far iam not sure were my refund went please let me knowtom atkinson
1,cut smaller than usual i agree these are cut small buy an inch or two larger than you normally do the waist band does not stretch
1,wrong item sent i got the shippment quickly but wrong items was sent i have to return it to the seller i got the refund pretty quick but only for the value of product i spent about  for two way shipping without geting anything
1,too bad did not like the pants at all and threw them in the trash rather than pay return postage flimsy smelled of dye cheap fabric etc too bad
2,dockers do the job this product was just what i was hoping for and i had no problem with shipping i highly recommend this product
1,false advertising if you search for super saver shipping this advertisement comes up but this product is not shipped by amazon is does not go out with the super saver shipping and the cost of shipping is nearly  the cost of the pants
1,dont trust the images dockers are dockers so thats not the problem just be sure you dont trust the images if you choose to buy these via amazon cafe for example should be coffee despite the fact that the image for cafe shows a stone or very light gray color cafe is actually dark brown so the product isnt defective but is misleading i didnt want brown pants but thats what i got
1,so disappointed i have worn these pants for years my size is the same as always i couldnt get them on they were so tight i couldnt get the button buttoned around the waist what is going on these pants seemed to be cut for a skinny  year old not someone who is a little on the hefty side further the shipping and handling charges are just out of sight above and beyond the already rather pricy product i would not recommend doing business with this seller at all you can go to other outlets and get the same thing without the shipping and handling and there are deals out there from major store chains i was really disappointed in this product and the seller go to walmart and get their khakis they are very inexpensive and wear like iron
2,fantastic book this book is a modern retelling of sleeping beauty with an emphasis on the power of family to help a boy through a terrible time it is best suited for a mature inquisitive child war is a reality that parents should not shy away from talking about to their children
1,disturbing although the images are very well rendered they arefrightening i am baffled about the impression this book is supposedto leave on children this book may be picked up on the thought that it is a retold fairy tale when it is an abstract and grim retelling of the horrors of wwii in berlin the most horrifying image is that of major kreigs big black gloves enveloping the body of the little boy this book is not appropriate for younger readers i can see how this book might be valuable for an alternative look at the war for middle schoolers or higher
2,a taste of italy longing for vicarious travel imagining your college days interrupted by an italian adventure  which turns into one of the romantic kind and full of the silly things that come with youth attraction and confusion i just wanted to add my twocents on this item which i found despite brief lapses in credibility and hoppingly gullible moments sufficiently engaging to remind me of my love of rome and now i have an even greater appreciation for the breadth and depth of italian culture and character and the wonders of eating their special dishes fun and satisfying
2,perfect book for a long flight  or a lazy afternoon this book is like watching a romantic movie it is interesting feel good and tasty capella has done a good job of holding the readers interest with fun descriptions of food chefs rome locals and the italian countrysidei happened to pick this book up at a used book store and i am glad i did youll like this book if you are a romantic a foodie love to travel love italy and italian food or all of the above
2,delicious reading i found the book to be lighthearted fun and relatively fastmoving true it was predictable but that didnt detract from capellas take on the triad of bruno laura and tomasso in fact it was nice to see how cappella put his spin on the cyrano story the descriptions of the food and the locale enhanced the story and added to the atmosphere though at times were a trifle overdone pun intended the only thing that kept me from giving this a  was the authors descriptions of the sex scenes which were at times too graphic  too male perhaps like reading playboypenthouse letters  for my taste in all though the book was entertaining and a fun way to occupy a few summer afternoons
2,wonderfully romantic book that sweeps you to italy the food of love is absolutely amazing from page one i felt like i was in italy smelling the smells seeing the sights and above all tasting the foodthis book is for those who love life in all its sensual glory who believe in recognizing your soul mate at first sight and who think that fairy tales can come true i devoured the book pun intended from start to finish it made me appreciate food and its preparation and were booking a trip to italy as soon as possible to discover some of the dishes describedwhat water for chocolate did for mexican food this does for italian there is magic in preparing food for those you love this is a fable a romance in the medieval sense of the word its about the magic and wonder of food and love the sensual beauty of the world
2,i just wanted to cook for my husband on those dark and stary nights this book is better than any of the great trashy historical romances i have ever read i love to cook i love to eat i love my husband this book made a great week for all three it was an inspiration for me to perfect a couple of things cooking and uhmmmm if you want to get inspired too then read this book id pair it with a couple of cooking books like cooking in the nude the one for newlyweds booty food intercourses or something like that enjoy a great book
2,one of the best if you are looking for something that entertains tells a great story and inspires you to want to go to italy and fall in love with someone or with the food this is the perfect book i recommend it as mandatory reading for all groups i bring to italy all who have read it especially women love it
2,cameriere i enjoyed this book it was much better than the standard chick lit titles it was a lightweight story easy to read and the roman food cooking markets and people were fun didnt mind the creative cursing how very true to roman young stud it was maybe the laura character was a bit underdeveloped but i much prefered to read about brunoi liked this book so much more than cooking for mr latte  it was a fun read
2,food porn and i mean that in the best possible way i didnt like the ending the characterization leave something to be desired and the writing didnt make me think but oh i didnt notice any of that well except for the ending at the time or even until substatially after it was all over during i read and read bathing in the glorious food descriptions not to mention the allure of italy oh yes
2,chick lit  for foodies what a great read  tips on cookinglovemaking and italian insults laughed and laughed thanks looking forward to film
1,not very good i bought this book to read as i myself ventured the streets of italyand to my dismay the book was horrible i searched everywhere for the book here in the states and it was sold out everywhereand to be honest i am not sure why all of the characters were not very well depicted except for laura the description of rome and the other cities the book took place in where not vivid and the plot very predictible the addition of the mafia in the story could have also been completely taken outthere was no need for it in the book i just cant seem to think of anything really good to say about this bookmaybe the recepies at the end are good to cook
1,do not waste your timelousy this is one of the worst written books i have ever readi wish i had saved my money and my timethe book is full of superlatives everything is the best ever experienced again and againthe characters never become embraceable one male character is pathetic while the other is a jerk the female lead is portrayed as perhaps innocently unaware but is really just stupid her friend is promiscuous which is all we ever really get to know of herthe writing is at a level well below that of an adult reader but the content could not possibly be meant for a younger reader very inappropriatenot sure who would really like this bookmaybe someone who really likes descriptions of food and does not care about plot story development characterization or any other facets of literaturefind yourself something with a little more substance and i think youll be much happier
1,the food is sexier than the sex this book as all about the joy of eating and cooking and loveits a lot better when it deals with food than with love in fact food is not only a metaphor for love and lovemaking but seems a more than adequate substitute people have virtual orgasms cooking and eating but the sex is pallid and occasionally positively unappetizingi can see why this book has been successful but to appreciate it one has to overlook the thin characters and absurd plot openly cribbed from cyrano de bergerac the most enjoyable parts are the opening chapters after that the returns swiftly diminishstill for a plane ride one could do worse i suppose
1,back to basics generally speaking a great book if you are not familiar with management accounting and turning heaps of information into valuable reports for your top management group no doubt about it this book will provide the basic tools for keeping your boss happy especially if you need a brushup on moving averages etc having vast experience with both advanced financial and nonfinancial analysis on various aspects of business shipping and construction this book was somewhat a let down in terms of ability to inspire and provide ways to improve personal skills to structure and present complex topics in an ordered and clear fashion a nice bedtablereader for the premba mbas should look elsewhere
1,cash money and no limit are tha same thang there beats are different than no limits but there from tha same place and there ghetto hood is very closethey rap just like no limitbut no limit was first and it will be tha lastno limit is still number in every way
1,just as trashy as garbage music comes i listen to every kind of music in existence and i always give everything a chance but now im permanently going to start ignoring every cd with a cash money record label on it theyre cash money millionaires and why because they fill a cd with a bunch of horrible songs and repetitive beats theyre millionaires because they repeat the words huh what and yeah for every  or  minute song they make theyre millionaires because people who expect this kind of music to be the next big thing make them millionaires bottom line hotboys are garbage and so is every other artist signed onto the cash money label i will never consider this good music and i hope that this is just a passing fad because if this is what socalled hiphop music is coming tothen i only hope its worth your money cause i aint gonna spend a penny on it
1,this album is garbagestraight bfi material cash money records is going to have to up with something a lil better than this if they plan on making it in this gamethe beats where alright but the rappers a terriblenone of the have a goog flow to accomidate the beatstry again cmrmaybe next time
2,i feel ya ghenryaolthis cd rocks no limit cant i feel ya ghenryaolcomthis cd rocks no limit cant touch cash  money records i dont know why that new tru cd sold one million in the first place who cares cause i just checked the billboard charts and discovered that juvenile sold more that two million so they cant be faded anyway back to this cd every song on this cd rocks my favorite song is help by bg i love this cd
1,save your  i cant believe how much this cd sucks save yourself  bucks  just download the we on fire mp its the only decent track on the album and if u r looking for more bounce party tracks like back that ass up too bad u wont find any here what a rip
1,please dont buy this cd i was truly disappointed in this album the beats are all overused and unoriginal the only thing that makes this album is young turk he has the hottest rap out of all the hot boys if you havent heard his freestyle you dont know whats up turk is off da chains i cant wait for his solo album to drop yall need to recognize quit hatin turk
2,worst music everbut i love it i dont know if you can actually call this music it is truly terrible however i love listening to it for some strange music  i am not normally a fan of rap music but i laugh out loud every time i hear some of these songs these cash money guys should be comedians except for juvenile since i cant understand anything he says which is also rather funny dont buy it for the music but it for the comedy
2,classic most underrated rap group when lil wayne actually talked real s besides aliens and skateboardsif u like lil wayne u should deffinetly love this album
2,no not  starz  starz this album hea is just too hot this album is tha first album that really made me like all the songs cash money is my favorite rap label and i like other labels too but it dont get no realer than this right cha this album is just to real i mean every song on it just blow up every single day when i come home from school i just have to stop and take some time out and listen to hot boys guerilla warfare like i said in the beginning not  starz  starz if you know what i mean
1,this is a one compared to juvenilez  degreez all i will say is this was a great release when i first bought it and i would have given it a four but after having heard juveniles  degreez today sept   for the first time note yes i know im late listening to juveniles  degreez i was very disappointed with manie fresh and juvenile juveniles  degreez is the best cd since snoopss doggystyle and dres chronic but this cd is nothing compared to juveniles  degreez if you dont have  degreez go buy that one instead of this
1,the worst rap i ever heard this is what is in the dictionary under wack i cant belive that this many people bought this  the hot boys are just a fad like bellbottoms  if you think this is what rap is about u just plain stupid and im glad this hot boy stuff is almost over wit when some of my friends play this crap in the car i just rather get out and walk
2,super hot lil wayne and turk set the whole cd off the untamed killer seem to know how to flow his beats are for real and i cant wait for lil wayne to come out with his solo cd
1,super wack just like nolimit cash money has no shame at putting out garbage musicwack beats and no lyric ryhmeswho is buying this crab all the stuff sounds the same and its not that averageits all bad
